APT,Aliases,Alleged Location,Allegiance/Affiliation,Targeted Sectors,TARGETED COUNTRIES,TOOL,INFO,REFERENCE
APT1,"Comment Crew, Comment Group, Comment Panda,  Byzantine Candor, Byzantine Hades, Group 3, TG-8223, Brown Fox, GIF89a, ShadyRAT, Shanghai Group",CHINA,"2nd Bureau of the Peoples Liberation Army (PLA) General Staff Departments (GSD) 3rd Department, PLA Unit 61398","aviation & aerospace, chemical & petrochemical, infrastructure, higher education, energy, engineering, media & entertainment, financial institutions institutions, hospitality & retail, agriculture, government & defense, healthcare, high technology, it & electronics, manufacturing, mining,oil & gas, navigation, ngo/npo & think tanks, research institute, telecommunications, transportation","BELGIUM, CANADA, FRANCE, INDIA, ISRAEL, JAPAN, LUXEMBOURG, NORWAY,SINGAPORE, SOUTH AFRICA, SWITZERLAND, TAIWAN, UNITED ARAB EMIRATES, UNITED KINGDOM,UNITED STATES","auriga, bangat, biscuit, bouncer, cachedump, calendar, combos, cookiebag, dairy, getmail, glooxmail, goggles, gsecdump, hacksfase, helauto, kurton, lslsass, manitsme, mapiget, mimikatz, miniasp, newsreels, pass-the-hash toolkit, poison ivy, pwdump, seasalt, shadyrat, starsypound, sword, tabmsgsql, tarsip, tasklist, webc2-adspace, webc2-ausov, webc2-bolid, webc2-cson, webc2-div, webc2-greencat, webc2-head, webc2-kt3, webc2-qbp, webc2-rave, webc2-table, webc2-ugx, webc2-yahoo","Also known as APT1, Comment Crew is an advanced persistent threat (APT) group with links to the Chinese military. The threat actors, which were active from roughly 2006 to 2010, managed to strike over 140 US companies in the quest for sensitive corporate and intellectual property data. The group earned their name through their use of HTML comments to hide communication to the command-and-control servers. The usual attack vector was via spear-phishing campaigns utilizing emails which contained documents with names tailored for the potential victims, such as “ArmyPlansConferenceOnNewGCVSolicitation.pdf,” or “Chinese Oil Executive Learning From Experience.doc.”",https://www.symantec.com/connect/blogs/apt1-qa-attacks-comment-crew
APT3,"Gothic Panda, Pirpi, UPS Team, Buckeye, Threat Group-0110, TG-0110",CHINA,Ministry of State Security and Internet security firm Guangzhou Bo Yu Information Technology Company Limited (“Boyusec”),"aviation & aerospace, infrastructure, government & defense, high technology, manufacturing, telecommunications, transportation","BELGIUM,HONG KONG,ITALY,LUXEMBOURG,PHILIPPINES,SWEDEN,UNITED KINGDOM,UNITED STATES,VIETNAM","apt3 keylogger, bemstour, cookiecutter, doublepulsar, eternalblue, htran, hupigon, kaba, lazagne, osinfo, pirpi, plugx, shareip, shotput, ttcalc, w32times, firefox, flash","APT3  is a sophisticated threat group that has been active since at least 2010. APT3 utilizes a broad range of tools and techniques including spear-phishing attacks, zero-day exploits, and numerous unique and publicly available remote access tools (RAT). Victims of APT3 intrusions include companies in the defense, telecommunications, transportation, and advanced technology sectors — as well as government departments and bureaus in Hong Kong, the U.S., and several other countries. (https://www.recordedfuture.com/chinese-mss-behind-apt3/)",
APT5,"MANGANESE,BRONZE FLEETWOOD",CHINA,,"government & defense, high technology, it & electronics, telecommunications","THAILAND,MALAYSIA,VIETNAM,SINGAPORE,BRUNEI,PHILIPPINES,INDONESIA",leouncia,"We have observed one APT group, which we call APT5, particularly focused on telecommunications and technology companies. More than half of the organizations we have observed being targeted or breached by APT5 operate in these sectors. Several times, APT5 has targeted organizations and personnel based in Southeast Asia. APT5 has been active since at least 2007. It appears to be a large threat group that consists of several subgroups, often with distinct tactics and infrastructure. APT5 has targeted or breached organizations across multiple industries, but its focus appears to be on telecommunications and technology companies, especially information about satellite communications. APT5 targeted the network of an electronics firm that sells products for both industrial and military applications. The group subsequently stole communications related to the firm’s business relationship with a national military, including inventories and memoranda about specific products they provided. In one case in late 2014, APT5 breached the network of an international telecommunications company. The group used malware with keylogging capabilities to monitor the computer of an executive who manages the company’s relationships with other telecommunications companies. (https://www.fireeye.com/content/dam/fireeye-www/current-threats/pdfs/rpt-southeast-asia-threat-landscape.pdf)",
APT6,1.php Group,CHINA,,government & defense,UNITED STATES,poison ivy,"The FBI issued a rare bulletin admitting that a group named Advanced Persistent Threat 6 (APT6) hacked into US government computer systems as far back as 2011 and for years stole sensitive data. The FBI alert was issued in February and went largely unnoticed. Nearly a month later, security experts are now shining a bright light on the alert and the mysterious group behind the attack. “This is a rare alert and a little late, but one that is welcomed by all security vendors as it offers a chance to mitigate their customers and also collaborate further in what appears to be an ongoing FBI investigation,” said Deepen Desai, director of security research at the security firm Zscaler in an email to Threatpost. Details regarding the actual attack and what government systems were infected are scant. Government officials said they knew the initial attack occurred in 2011, but are unaware of who specifically is behind the attacks. “Given the nature of malware payload involved and the duration of this compromise being unnoticed – the scope of lateral movement inside the compromised network is very high possibly exposing all the critical systems,” Deepen said.",https://threatpost.com/fbi-quietly-admits-to-multi-year-apt-attack-sensitive-data-stolen/117267/
APT12,"IXESHE, DynCalc, Numbered Panda, DNSCALC, TG-2754, BeeBus, Calc Team, Group 22, Crimson Iron",CHINA,State-sponsored,"government & defense, it & electronics, high technology, telecommunications, journalists","JAPAN,TAIWAN","aumlib, dyncalc/dnscalc, etumbot, hightide, ixeshe, rapidstealer, riptide, threebyte, waterspout","Numbered Panda has a long list of high-profile victims and is known by a number of names including: DYNCALC, IXESHE, JOY RAT, APT-12, etc. Numbered Panda has targeted a variety of victims including but not limited to media outlets, high-tech companies, and multiple governments. Numbered Panda has targeted organizations in time-sensitive operations such as the Fukushima Reactor Incident of 2011, likely filling intelligence gaps in the ground cleanup/mitigation operations. Screen saver files, which are binary executables and PDF documents, are common Numbered Panda weaponization tactics. One of the most interesting techniques that Numbered Panda likes to use is to dynamically calculate the Command and Control (C2) port by resolving a DNS. This effectively helps Numbered Panda bypass egress filtering implemented to prevent unauthorized communications on some enterprises. The malware will typically use two DNS names for communication: one is used for command and control; the other is used with an algorithm to calculate the port to communicate to.",https://www.crowdstrike.com/blog/whois-numbered-panda/
APT14,"Anchor Panda, Aluminium, QAZTeam",CHINA,PLA Navy,"aviation & aerospace, government & defense, It & engineering, npo & think tanks","AUSTRALIA,GERMANY,SWEDEN,UNITED KINGDOM, UNITED STATES","gh0st rat, poison ivy, torn rat","Anchor Panda is an adversary that CrowdStrike has tracked extensively over the last year targeting both civilian and military maritime operations in the green/brown water regions primarily in the area of operations of the South Sea Fleet of the PLA Navy. In addition to maritime operations in this region, Anchor Panda also heavily targeted western companies in the US, Germany, Sweden, the UK, and Australia, and other countries involved in maritime satellite systems, aerospace companies, and defense contractors. Not surprisingly, embassies and diplomatic missions in the region, foreign intelligence services, and foreign governments with space programs were also targeted. (https://www.crowdstrike.com/blog/whois-anchor-panda/)",
APT16,SVCMONDR,CHINA,,"financial institutions, government & defense, high technology, media & entertainment","JAPAN,THAILAND,TAIWAN","elmer, ironhalo, svcmondr","Between November 26, 2015, and December 1, 2015, known and suspected China-based APT groups launched several spear-phishing attacks targeting Japanese and Taiwanese organizations in the high-tech, government services, media and financial services industries. Each campaign delivered a malicious Microsoft Word document exploiting the aforementioned EPS dict copy use-after-free vulnerability, and the local Windows privilege escalation vulnerability CVE-2015-1701. The successful exploitation of both vulnerabilities led to the delivery of either a downloader that we refer to as IRONHALO, or a backdoor that we refer to as ELMER.",https://www.fireeye.com/blog/threat-research/2015/12/the-eps-awakens-part-two.html
APT17,"Deputy Dog, Tailgater Team, Dogfish",CHINA,State-sponsored,"government & defense, it & electronics, mining,oil & gas, ngo/npo & think tanks","UNITED STATES,BELGIUM,CHINA,GERMANY,INDONESIA,ITALY,JAPAN,NETHERLANDS,SWITZERLAND,RUSSIA,UNITED KINGDOM","9002 rat, blackcoffee, deputydog, hikit, plugx","APT 17 is a China-based threat group that has conducted network intrusions against U.S. government entities, the defense industry, law firms, information technology companies, mining companies, and non-government organizations. This group appears to be closely associated with Hidden Lynx, Aurora Panda.",https://www.fireeye.com/blog/threat-research/2013/09/operation-deputydog-zero-day-cve-2013-3893-attack-against-japanese-targets.html
APT18,"TG-0416, Dynamite Panda, Threat Group-0416, Wekby, Scandium",CHINA,PLA Navy,"aviation & aerospace, biotechnology, Construction, government & defense, higher education, engineering, healthcare, high technology, telecommunications, transportation",UNITED STATES,"gh0st rat, hcdloader, httpbrowser, pisloader, roseam, stickyfingers","Wekby was described by Palo Alto Networks in a 2015 report as: ‘Wekby is a group that has been active for a number of years, targeting various industries such as healthcare, telecommunications, aerospace, defense, and high tech. The group is known to leverage recently released exploits very shortly after those exploits are available, such as in the case of Hacking Team’s Flash zero – day exploit.’ This threat group has been seen since 2009.",https://www.fireeye.com/blog/threat-research/2015/07/demonstrating_hustle.html
APT19,"Codoso, C0d0so0, Codoso Team, Sunshop Group",CHINA,"Likely to be freelancers, with some connection with the Chinese government. (FireEye)","higher education, energy, financial institutions, government & defense, high technology, manufacturing, pharmaceutical, telecommunications, npo & think tanks, activists & dissidents",,"c0d0so, cobalt strike, empire, derusbi","APT 19 is a Chinese-based threat group that has targeted a variety of industries, including defense, finance, energy, pharmaceutical, telecommunications, high tech, education, manufacturing, and legal services. In 2017, a phishing campaign was used to target seven law and investment firms. Some analysts track APT19 and DarkHydrus as the same group, but it is unclear from open source information if the groups are the same.","https://unit42.paloaltonetworks.com/new-attacks-linked-to-c0d0s0-group/, https://www.fireeye.com/blog/threat-research/2017/06/phished-at-the-request-of-counsel.html"
APT20,"APT8, Violin Panda, TH3Bug",CHINA,,"chemical & petrochemical, energy, it & engineering, financial institutions, government & defense, healthcare, high technology, pharmaceutical, telecommunications, transportation","THAILAND,UNITED STATES,CHINA","cakelog, candyclog, cettra, cookieclog, plugx, poison ivy","We’ve uncovered some new data and likely attribution regarding a series of APT watering hole attacks this past summer. Watering hole attacks are an increasingly popular component of APT campaigns, as many people are more aware of spear phishing and are less likely to open documents or click on links in unsolicited emails. Watering hole attacks offer a much better chance of success because they involve compromising legitimate websites and installing malware intended to compromise website visitors. These are often popular websites frequented by people who work in specific industries or have political sympathies to which the actors want to gain access. In contrast to many other APT campaigns, which tend to rely heavily on spear phishing to gain victims, “th3bug” is known for compromising legitimate websites their intended visitors are likely to frequent. Over the summer they compromised several sites, including a well-known Uyghur website written in that native language.",https://unit42.paloaltonetworks.com/recent-watering-hole-attacks-attributed-apt-group-th3bug-using-poison-ivy/
APT28,"SNAKEMACKEREL, Swallowtail, Group 74, Sednit, Sofacy, Pawn Storm, Fancy Bear, STRONTIUM, Tsar Team, Threat Group-4127, TG-4127",RUSSIA,"Intelligence Directorate of the Russian General Staff,  GRU units 26165 and Unit 74455","chemical & petrochemical, diplomatic/embassies, it & engineering, government & defense, media & entertainment, ngo/npo & think tanks","AFGHANISTAN, ARMENIA, BELGIUM, BULGARIA, CANADA, CHILE, CHINA, CROATIA, CYPRUS, FRANCE, GEORGIA, GERMANY, HUNGARY, IRAN, IRAQ, JAPAN, JORDAN, KAZAKHSTAN, MEXICO, MONGOLIA, NETHERLANDS, NORWAY, PAKISTAN, POLAND, SOUTH AFRICA, SOUTH KOREA, TAJIKISTAN, TURKEY, UGANDA, UNITED ARAB EMIRATES, UNITED KINGOM, UNITED STATES, UZBEKISTAN","advstoreshell, cannon, certutil, chopstick, computrace, coreshell, dealerschoice, downdelph, downrange, dropper, eviltoss, foozer, forfiles, hidedrv, jhuhugit, koadic, komplex, lojax, mimikatz, oldbait, pocodown, responder, sedkit, sednit, sedreco, seduploader, sofacy, sourface, usbstealer, winexe, winids, x-agent,  xtunnel, zebrocy","APT 28 is a threat group that has been attributed to Russia’s Main Intelligence Directorate of the Russian General Staff by a July 2018 U.S. Department of Justice indictment. This group reportedly compromised the Hillary Clinton campaign, the Democratic National Committee, and the Democratic Congressional Campaign Committee in 2016 in an attempt to interfere with the U.S. presidential election. APT 28 has been active since at least January 2007. (FireEye) APT28 likely seeks to collect intelligence about Georgia’s security and political dynamics by targeting officials working for the Ministry of Internal Affairs and the Ministry of Defense. APT28 has demonstrated interest in Eastern European governments and security organizations. These victims would provide the Russian government with an ability to predict policymaker intentions and gauge its ability to influence public opinion. APT28 appeared to target individuals affiliated with European security organizations and global multilateral institutions. The Russian government has long cited European security organizations like NATO and the OSCE as existential threats, particularly during periods of increased tension in Europe.",https://attack.mitre.org/groups/G0007/
APT29,"YTTRIUM, The Dukes, Cozy Bear, CozyDuke, Group 100, Iron Hemlock, Minidionis, CloudLook, Grizzly Steppe",RUSSIA,State-sponsored," energy, government & defense, law enforcement, media & entertainment, pharmaceutical, telecommunications, ngo/npo & think tanks, transportation, healthcare","AUSTRALIA, AZERBAIJAN, BELARUS, BELGIUM, BRAZIL, BULGARIA, CANADA,CHINA, CYPRUS, CZECH, FRANCE, GEORGIA, GERMANY, HUNGARY, INDIA, IRELAND, ISRAEL, JAPAN, KAZAKHSTAN, KYRGYZSTAN, LATVIA, LEBANON, LITHUANIA, LUXEMBOURG, MEXICO, MONTENEGRO, NETHERLANDS, NEW ZEALAND, PORTUGAL, ROMANIA, RUSSIA, SLOVENIA, SPAIN, SOUTH KOREA, TURKEY, UGANDA, UNITED KINGDOM, UNITED STATES, UZBEKISTAN","ati-agent, cloudduke, cobalt strike, cosmicduke, cozyduke, cozycar, geminiduke, hammerduke, hammertoss, meek, mimikatz, miniduke, pinchduke, poshspy, powerduke, seadaddy, seaduke, tdiscoverer, wellmess, wellmail","The Dukes are a well-resourced, highly dedicated and organized cyberespionage group that we believe has been working for the Russian Federation since at least 2008 to collect intelligence in support of foreign and security policy decision-making. The Dukes primarily target Western governments and related organizations, such as government ministries and agencies, political think tanks, and governmental subcontractors. Their targets have also included the governments of members of the Commonwealth of Independent States; Asian, African, and Middle Eastern governments; organizations associated with Chechen extremism; and Russian speakers engaged in the illicit trade of controlled substances and drugs. The Dukes are known to employ a vast arsenal of malware toolsets, which we identify as MiniDuke, CosmicDuke, OnionDuke, CozyDuke, CloudDuke, SeaDuke, HammerDuke, PinchDuke, and GeminiDuke. In recent years, the Dukes have engaged in apparently biannual large-scale spear-phishing campaigns against hundreds or even thousands of recipients associated with governmental institutions and affiliated organizations. These campaigns utilize a smash-and-grab approach involving a fast but noisy break-in followed by the rapid collection and exfiltration of as much data as possible. If the compromised target is discovered to be of value, the Dukes will quickly switch the toolset used and move to using stealthier tactics focused on persistent compromise and long-term intelligence gathering. In addition to these large-scale campaigns, the Dukes continuously and concurrently engage in smaller, much more targeted campaigns, utilizing different toolsets. These targeted campaigns have been going on for at least 7 years. The targets and timing of these campaigns appear to align with the known foreign and security policy interests of the Russian Federation at those times.",https://www.f-secure.com/documents/996508/1030745/dukes_whitepaper.pdf
APT30,Override Panda,CHINA,State-sponsored,government & defense," BHUTAN, BRUNEI, CAMBODIA, INDIA, INDONESIA, JAPAN, LAOS, MALAYSIA, MYANMAR, NEPAL, PHILIPPINES, SAUDI ARABIA, SINGAPORE, SOUTH KOREA, THAILAND, VIETNAM,UNITED STATES","backbend, backspace, creamsicle, flashflood, gemcutter, milkmaid, neteagle, orangeade, shipshape, spaceship","APT 30 is a threat group suspected to be associated with the Chinese government. While Naikon shares some characteristics with APT 30, the two groups do not appear to be exact matches. (FireEye) When our Singapore-based FireEye labs team examined malware aimed predominantly at entities in Southeast Asia and India, we suspected that we were peering into a regionally focused cyber espionage operation. The malware revealed a decade-long operation focused on targets—government and commercial—who hold key political, economic, and military information about the region. This group, who we call APT30, stands out not only for their sustained activity and regional focus, but also for their continued success despite maintaining relatively consistent tools, tactics, and infrastructure since at least 2005. Based on our knowledge of APT30's targeting activity and tools, their objective appears to be data theft as opposed to financial gain. APT30 has not been observed to target victims or data that can be readily monetized (for example, credit card data, personally identifiable information, or bank transfer credentials). Instead, their tools include functionality that allows them to identify and steal documents, including what appears to be an interest in documents that may be stored on air-gapped networks. The group expresses a distinct interest in organizations and governments associated with ASEAN, particularly so around the time of official ASEAN meetings. Many of APT30’s decoy documents use topics related to Southeast Asia, India, border areas, and broader security and diplomatic issues. Decoy documents attached to spear phishing emails are frequently indicators of intended targeting because threat actors generally tailor these emails to entice their intended targets —who typically work on related issues—to click on the attachments and infect themselves. In addition to APT30’s Southeast Asia and India focus, we’ve observed APT30 target journalists reporting on issues traditionally considered to be focal points for the Chinese Communist Party’s sense of legitimacy, such as corruption, the economy, and human rights. In China, the Communist Party has the ultimate authority over the government. China-based threat groups have targeted journalists before; we believe they often do so to get a better understanding on developing stories to anticipate unfavorable coverage and better position themselves to shape public messaging.",https://www2.fireeye.com/rs/fireye/images/rpt-apt30.pdf
APT32,"SeaLotus, OceanLotus, APT-C-00, Ocean Buffalo",VIETNAM,State-sponsored,"government & defense, hospitality & retail, manufacturing, hospitality & retail, activists & dissidents, journalists","AUSTRALIA, BRUNEI, CAMBODIA, CHINA, GERMANY, INDONESIA, LAOS, MALAYSIA, MYANMAR, PHILIPPINES, SINGAPORE, THAILAND, UNITED STATES,VIETNAM","cactustorch, cobalt strike, cuegoe, denis, fingerprintjs2, goopy, kerrdown, komprogo, mimikatz, nishang, osx_oceanlotus.d, phoreal, powersploit, salgorea, soundbite, terracotta vpn, windshield","Since at least 2014, FireEye has observed APT32 targeting foreign corporations with a vested interest in Vietnam’s manufacturing, consumer products, and hospitality sectors. Furthermore, there are indications that APT32 actors are targeting peripheral network security and technology infrastructure corporations. In addition to focused targeting of the private sector with ties to Vietnam, APT32 has also targeted foreign governments, as well as Vietnamese dissidents and journalists since at least 2013.",https://www.fireeye.com/blog/threat-research/2017/05/cyber-espionage-apt32.html
APT33,"Elfin, Magnallium",IRAN,State-sponsored,"aviation & aerospace, government & defense, energy, chemical & petrochemical","UNITED STATES, SAUDI ARABIA, SOUTH KOREA","autoit backdoor, darkcomet, dropshot, empire, lazagne, mimikatz, nanocore rat, netwire rc, poshc2, powersploit, powerton, pupyrat, quasarrat, remcos, ruler, shamoon, shapeshift, turnedup","When discussing suspected Middle Eastern hacker groups with destructive capabilities, many automatically think of the suspected Iranian group that previously used SHAMOON – aka Disttrack – to target organizations in the Persian Gulf. However, over the past few years, we have been tracking a separate, less widely known suspected Iranian group with potential destructive capabilities, whom we call APT33. Our analysis reveals that APT33 is a capable group that has carried out cyber espionage operations since at least 2013. We assess APT33 works at the behest of the Iranian government. APT33 has targeted organizations – spanning multiple industries – headquartered in the United States, Saudi Arabia and South Korea. APT33 has shown particular interest in organizations in the aviation sector involved in both military and commercial capacities, as well as organizations in the energy sector with ties to petrochemical production. APT 33 seems to be closely related to OilRig, APT 34, Helix Kitten.",https://www.fireeye.com/blog/threat-research/2017/09/apt33-insights-into-iranian-cyber-espionage.html
