APT,Aliases,Alleged Location,Allegiance/Affiliation,Targeted Sectors,TARGETED COUNTRIES,TOOL,INFO,REFERENCE
PLATINUM,TwoForOne,CHINA,,"government & defense, government & defense, telecommunications","CHINA, INDIA, INDONESIA, MALAYSIA, SINGAPORE,THAILAND","adbupd, amtsol, dipsind, jpin","Platinum has been targeting its victims since at least as early as 2009, and may have been active for several years prior. Its activities are distinctly different not only from those typically seen in untargeted attacks, but from many targeted attacks as well. A large share of targeted attacks can be characterized as opportunistic: the activity group changes its target profiles and attack geographies based on geopolitical seasons, and may attack institutions all over the world. Like many such groups, Platinum seeks to steal sensitive intellectual property related to government interests, but its range of preferred targets is consistently limited to specific governmental organizations, defense institutes, intelligence agencies, diplomatic institutions, and telecommunication providers in South and Southeast Asia. The group’s persistent use of spear-phishing tactics (phishing attempts aimed at specific individuals) and access to previously undiscovered zero-day exploits have made it a highly resilient threat.",https://download.microsoft.com/download/2/2/5/225BFE3E-E1DE-4F5B-A77B-71200928D209/Platinum%20feature%20article%20-%20Targeted%20attacks%20in%20South%20and%20Southeast%20Asia%20April%202016.pdf
Poseidon Group,,PORTUGAL/BRAZIL,,"energy, financial institutions, government & defense, media & entertainment, manufacturing, telecommunications, utilities","BRAZIL, FRANCE, INDIA, KAZAKHSTAN, RUSSIA, UNITED ARAB EMIRATES,UNITED STATES",igt supertool,"During the latter part of 2015, Kaspersky researchers from GreAT (Global Research and Analysis Team) got hold of the missing pieces of an intricate puzzle that points to the dawn of the first Portuguese-speaking targeted attack group, named “Poseidon.” The group’s campaigns appear to have been active since at least 2005, while the very first sample found points to 2001. This signals just how long ago the Poseidon threat actor was already working on its offensive framework. The Poseidon Group is a long-running team operating on all domains: land, air, and sea. They are dedicated to running targeted attacks campaigns to aggressively collect information from company networks through the use of spear-phishing packaged with embedded, executable elements inside office documents and extensive lateral movement tools. The information exfiltrated is then leveraged by a company front to blackmail victim companies into contracting the Poseidon Group as a security firm. Even when contracted, the Poseidon Group may continue its infection or initiate another infection at a later time, persisting on the network to continue data collection beyond its contractual obligation. The Poseidon Group has been active, using custom code and evolving their toolkit since at least 2005. Their tools are consistently designed to function on English and Portuguese systems spanning the gamut of Windows OS, and their exfiltration methods include the use of hijacked satellite connections. Poseidon continues to be active at this time",https://securelist.com/poseidon-group-a-targeted-attack-boutique-specializing-in-global-cyber-espionage/73673/
PROMETHIUM,StrongPity,TURKEY,,,"TURKEY,COLOMBIA,INDIA,CANADA,VIETNAM",truvasys,"Promethium is an activity group that has been active since at least 2012. The group conducted a campaign in May 2016 and has heavily targeted Turkish victims. Promethium has demonstrated similarity to another activity group called Neodymium due to overlapping victim and campaign characteristics. (Microsoft) Promethium is an activity group that has been active as early as 2012. The group primarily uses Truvasys, a first-stage malware that has been in circulation for several years. Truvasys has been involved in several attack campaigns, where it has masqueraded as one of server common computer utilities, including WinUtils, TrueCrypt, WinRAR, or SanDisk. In each of the campaigns, Truvasys malware evolved with additional features—this shows a close relationship between the activity groups behind the campaigns and the developers of the malware.",https://www.microsoft.com/security/blog/2016/12/14/twin-zero-day-attacks-promethium-and-neodymium-target-individuals-in-europe/
Putter Panda,"APT2, MSUpdater, Group 36, Sulphur, TG-6952",CHINA,Unit 61486 of the 12th Bureau of the PLAs 3rd General Staff Department (GSD),"government & defense, research institute, aviation & aerospace","UNITED STATES,JAPAN","3para rat, 4h rat, httpclient, msupdater, pngdowner, searchfire","Putter Panda is the name of bad actor responsible for a series of cyberespionage operations originating in Shanghai, security experts linked its operation to the activity of the People’s Liberation Army 3rd General Staff Department 12th Bureau Unit 61486. A fake yoga brochure was one of different emails used for a spear-phishing campaign conducted by the stealth Chinese cyber unit according an investigation conducted by researchers at the CrowdStrike security firm. Also in this case the experts believe that we are facing with a large scale cyberespionage campaign targeting government entities, contractors and research companies in Europe, USA and Japan. The group has been operating since at least 2007 and appears very interested in research companies in the space and satellite industry, experts at CrowdStrike have collected evidence of a numerous attacks against these industries.",https://cdn0.vox-cdn.com/assets/4589853/crowdstrike-intelligence-report-putter-panda.original.pdf
Rancor,Rancor Group,CHINA,,government & defense,"JAPAN,CAMBODIA,SINGAPORE","certutil, ddkong, plaintee","Throughout 2017 and 2018 Unit 42 has been tracking and observing a series of highly targeted attacks focused in South East Asia, building on our research into the KHRAT Trojan. Based on the evidence, these attacks appear to be conducted by the same set of attackers using previously unknown malware families. In addition, these attacks appear to be highly targeted in their distribution of the malware used, as well as the targets chosen. Based on these factors, Unit 42 believes the attackers behind these attacks are conducting their campaigns for espionage purposes. We believe this group is previously unidentified and therefore have we have dubbed it “Rancor”. The Rancor group’s attacks use two primary malware families which we describe in depth later in this blog and are naming DDKONG and PLAINTEE. DDKONG is used throughout the campaign and PLAINTEE appears to be new addition to these attackers’ toolkit.",https://unit42.paloaltonetworks.com/unit42-rancor-targeted-attacks-south-east-asia-using-plaintee-ddkong-malware-families/
Roaming Mantis,Roaming Mantis Group,CHINA,,software & game development,"SOUTH KOREA,JAPAN,CHINA,TAIWAN,FRANCE,SWITZERLAND,GERMANY,UNITED KINGDOM, UNITED STATES","fakespy, fakecop, funkybot","Our analysis shows that the threat actor behind the FakeSpy malware is a Chinese-speaking group, commonly referred to as ""Roaming Mantis"", a group that is known to have launched similar campaigns in the past. FakeSpy is an information stealer that exfiltrates and sends SMS messages, steals financial and application data, reads account information and contact lists, and more.",https://malpedia.caad.fkie.fraunhofer.de/actor/roaming_mantis
RTM,,RUSSIA,,banking,"RUSSIA,CZECH, GERMANY, KAZAKHSTAN, RUSSIA,UNITED KINGDOM",rtm,"There are several groups actively and profitably targeting businesses in Russia. A trend that we have seen unfold before our eyes lately is these cybercriminals’ use of simple backdoors to gain a foothold in their targets’ networks. Once they have this access, a lot of the work is done manually, slowly getting to understand the network layout and deploying custom tools the criminals can use to steal funds from these entities. Some of the groups that best exemplify these trends are Buhtrap, Cobalt Group and Corkow, Metel. The group discussed in this white paper is part of this new trend. We call this new group RTM; it uses custom malware, written in Delphi, that we cover in detail in later sections. The first trace of this tool in our telemetry data dates back to late 2015. The group also makes use of several different modules that they deploy where appropriate to their targets. They are interested in users of remote banking systems (RBS), mainly in Russia and neighboring countries",https://www.welivesecurity.com/wp-content/uploads/2017/02/Read-The-Manual.pdf
Sandworm Team,"Quedagh, VOODOO BEAR,Iron Viking,Quedagh, TEMP.Noble",RUSSIA,Russian pro-hacktivists,"higher education, energy, government & defense, telecommunications","AZERBAIJAN, BELARUS, GEORGIA, IRAN, ISRAEL, KAZAKHSTAN, KYRGYZSTAN, LITHUANIA, POLAND, RUSSIA,UNITED KINGDOM","blackenergy, gcat, passkilldisk","Sandworm Team is a Russian cyberespionage group that has operated since approximately 2009. The group likely consists of Russian pro-hacktivists. Sandworm Team targets mainly Ukrainian entities associated with energy, industrial control systems, SCADA, government, and media. Sandworm Team has been linked to the Ukrainian energy sector attack in late 2015. This group appears to be closely associated with, or evolved into, TeleBots.",https://blog.trendmicro.com/trendlabs-security-intelligence/timeline-of-sandworm-attacks/
Scarlet Mimic,,CHINA,,activists & dissidents,,"callme, fakem, mobileorder, psylo","Scarlet Mimic is a threat group that has targeted minority rights activists. This group has not been directly linked to a government source, but the group’s motivations appear to overlap with those of the Chinese government. While there is some overlap between IP addresses used by Scarlet Mimic and Putter Panda, APT 2, it has not been concluded that the groups are the same. (Palo Alto) The attacks began over four years ago and their targeting pattern suggests that this adversary’s primary mission is to gather information about minority rights activists. We do not have evidence directly linking these attacks to a government source, but the information derived from these activities supports an assessment that a group or groups with motivations similar to the stated position of the Chinese government in relation to these targets is involved. The attacks we attribute to Scarlet Mimic have primarily targeted Uyghur and Tibetan activists as well as those who are interested in their causes. Both the Tibetan community and the Uyghurs, a Turkic Muslim minority residing primarily in northwest China, have been targets of multiple sophisticated attacks in the past decade. Both also have history of strained relationships with the government of the People’s Republic of China (PRC), though we do not have evidence that links Scarlet Mimic attacks to the PRC. Scarlet Mimic attacks have also been identified against government organizations in Russia and India, who are responsible for tracking activist and terrorist activities. While we do not know the precise target of each of the Scarlet Mimic attacks, many of them align to the patterns described above.",https://unit42.paloaltonetworks.com/scarlet-mimic-years-long-espionage-targets-minority-activists/
Silence,"Oleg Skulkin, Group-IB",UNKNOWN,,financial institutions,"ARMENIA, AZERBAIJAN, BELARUS, KAZAKHSTAN, MALAYSIA, POLAND, RUSSIA,UNITED KINGDOM","atmosphere, silence","Group-IB has exposed the attacks committed by Silence cybercriminal group. While the gang had previously targeted Russian banks, Group-IB experts also have discovered evidence of the group's activity in more than 25 countries worldwide. Group-IB has published its first detailed report on tactics and tools employed by Silence. Group-IB security analysts' hypothesis is that at least one of the gang members appears to be a former or current employee of a cyber security company. The confirmed damage from Silence activity is estimated at 800 000 USD. Silence is a group of Russian-speaking hackers, based on their commands language, the location of infrastructure they used, and the geography of their targets (Russia, Ukraine, Belarus, Azerbaijan, Poland, and Kazakhstan). Although phishing emails were also sent to bank employees in Central and Western Europe, Africa, and Asia). Furthermore, Silence used Russian words typed on an English keyboard layout for the commands of the employed backdoor. The hackers also used Russian-language web hosting services.",https://www.group-ib.com/blog/silence
SilverTerrier,,NIGERIA,,"high technology, higher education, manufacturing",,"predator pain, pony, keybase, ispysoftware, isr stealer, agent tesla, lokibot, zeus, atmos, netwire, darkcomet, nanocore",,https://unit42.paloaltonetworks.com/silverterrier-2019-update/
Soft Cell,"Cybereason Nocturnus, @nocturnus",CHINA,,telecommunications,,"china chopper, nbtscan, mimikatz, wmi, psexec, runhelp.exe, portqry.exe, htran, winrar, cmd.exe, whoami, net.exe, ipconfig, powershell, poisonivy, plugx,","In 2018, the Cybereason Nocturnus team identified an advanced, persistent attack targeting global telecommunications providers carried out by a threat actor using tools and techniques commonly associated with Chinese-affiliated threat actors, such as APT10.  This multi-wave attacks focused on obtaining data of specific, high-value targets and resulted in a complete takeover of the network.",https://www.cybereason.com/blog/operation-soft-cell-a-worldwide-campaign-against-telecommunications-providers
Sowbug,,UNKNOWN,,government & defense,"ARGENTINA, BRAZIL, BRUNEI, ECUADOR, MALAYSIA,PERU","felismus, starloader","Symantec has identified a previously unknown group called Sowbug that has been conducting highly targeted cyberattacks against organizations in South America and Southeast Asia and appears to be heavily focused on foreign policy institutions and diplomatic targets. Sowbug has been seen mounting classic espionage attacks by stealing documents from the organizations it infiltrates. Symantec saw the first evidence of Sowbug-related activity with the discovery in March 2017 of an entirely new piece of malware called Felismus used against a target in Southeast Asia. We have subsequently identified further victims on both sides of the Pacific Ocean. While the Felismus tool was first identified in March of this year, its association with Sowbug was unknown until now. Symantec has also been able to connect earlier attack campaigns with Sowbug, demonstrating that it has been active since at least early-2015 and may have been operating even earlier. To date, Sowbug appears to be focused mainly on government entities in South America and Southeast Asia and has infiltrated organizations in Argentina, Brazil, Ecuador, Peru, Brunei and Malaysia. The group is well resourced, capable of infiltrating multiple targets simultaneously and will often operate outside the working hours of targeted organizations in order to maintain a low profile",https://www.symantec.com/connect/blogs/sowbug-cyber-espionage-group-targets-south-american-and-southeast-asian-governments
Stealth Falcon,,UAE,,"activists & dissidents, journalists","UNITED ARAB EMIRATES, UNITED KINGDOM",0days,"This report describes a campaign of targeted spyware attacks carried out by a sophisticated operator, which we call Stealth Falcon. The attacks have been conducted from 2012 until the present, against Emirati journalists, activists, and dissidents. We discovered this campaign when an individual purporting to be from an apparently fictitious organization called “The Right to Fight” contacted Rori Donaghy. Donaghy, a UK-based journalist and founder of the Emirates Center for Human Rights, received a spyware-laden email in November 2015, purporting to offer him a position on a human rights panel. Donaghy has written critically of the United Arab Emirates (UAE) government in the past, and had recently published a series of articles based on leaked emails involving members of the UAE government. Circumstantial evidence suggests a link between Stealth Falcon and the UAE government. We traced digital artifacts used in this campaign to links sent from an activist’s Twitter account in December 2012, a period when it appears to have been under government control. We also identified other bait content employed by this threat actor. We found 31 public tweets sent by Stealth Falcon, 30 of which were directly targeted at one of 27 victims. Of the 27 targets, 24 were obviously linked to the UAE, based on their profile information (e.g., photos, “UAE” in account name, location), and at least six targets appeared to be operated by people who were arrested, sought for arrest, or convicted in absentia by the UAE government, in relation to their Twitter activity.",https://citizenlab.ca/2016/05/stealth-falcon/
Stolen Pencil,,North Korea,,"higher education, ngo/npo & think tanks",,mimikatz,"ASERT has learned of an APT campaign, possibly originating from DPRK, we are calling Stolen Pencil that is targeting academic institutions since at least May 2018. The ultimate motivation behind the attacks is unclear, but the threat actors are adept at scavenging for credentials. Targets are sent spear phishing e-mails that lead them to a web site displaying a lure document and are immediately prompted to install a malicious Google Chrome extension. Once gaining a foothold, the threat actors use off-the-shelf tools to ensure persistence, including Remote Desktop Protocol (RDP) to maintain access. Key Findings • A wide variety of phishing domains imply other targets, but those focused on academia were intended to install a malicious Chrome extension. • A large number of the victims, across multiple universities, had expertise in biomedical engineering, possibly suggesting a motivation for the attackers targeting. • Poor OPSEC led to users finding open web browsers in Korean, English-toKorean translators open, and keyboards switched to Korean. • The threat actors use built-in Windows administration tools and commercial offthe-shelf software to “live off the land”. The threat actor at the keyboard uses RDP to access compromised systems rather than a backdoor or Remote Access Trojan (RAT). • Post-exploitation persistence is maintained by harvesting passwords from a wide variety of sources such as process memory, web browsers, network sniffing, and keyloggers. • There is no evidence of data theft, leaving the motivation behind Stolen Pencil largely uncertain.",https://www.netscout.com/blog/asert/stolen-pencil-campaign-targets-academia
Strider,ProjectSauron,UNKNOWN,,"diplomatic/embassies, financial institutions, government & defense, research institute, telecommunications.","RUSSIA,CHINA,SWEDEN,BELGIUM,IRAN,RWANDA",remsec,"Strider has been active since at least October 2011. The group has maintained a low profile until now and its targets have been mainly organizations and individuals that would be of interest to a nation state’s intelligence services. Symantec obtained a sample of the group’s Remsec malware from a customer who submitted it following its detection by our behavioral engine. Remsec is primarily designed to spy on targets. It opens a back door on an infected computer, can log keystrokes, and steal files. Strider has been highly selective in its choice of targets and, to date, Symantec has found evidence of infections in 36 computers across seven separate organizations. The group’s targets include a number of organizations and individuals located in Russia, an airline in China, an organization in Sweden, and an embassy in Belgium.",https://www.symantec.com/connect/blogs/strider-cyberespionage-group-turns-eye-sauron-targets
Suckfly,,CHINA,,"e-commerce, financial institutions, government & defense, healthcare, media & entertainment, shipping & logistics, software & game development",INDIA,"gsecdump, nidiran, rcpscan, smbscan, wce","In March 2016, Symantec published a blog on Suckfly, an advanced cyberespionage group that conducted attacks against a number of South Korean organizations to steal digital certificates. Since then we have identified a number of attacks over a two-year period, beginning in April 2014, which we attribute to Suckfly. The attacks targeted high-profile targets, including government and commercial organizations. These attacks occurred in several different countries, but our investigation revealed that the primary targets were individuals and organizations primarily located in India. While there have been several Suckfly campaigns that infected organizations with the group’s custom malware Backdoor.Nidiran, the Indian targets show a greater amount of post-infection activity than targets in other regions. This suggests that these attacks were part of a planned operation against specific targets in India.",https://www.symantec.com/connect/blogs/indian-organizations-targeted-suckfly-attacks
TA459,,CHINA,,financial institutions,"RUSSIA,BELARUS,MONGOLIA","gh0st rat, nettraveler, plugx, zerot","On April 20 [2017], Proofpoint observed a targeted campaign focused on financial analysts working at top global financial firms operating in Russia and neighboring countries. These analysts were linked by their coverage of the telecommunications industry, making this targeting very similar to, and likely a continuation of, activity described in our “In Pursuit of Optical Fibers and Troop Intel” blog. This time, however, attackers opportunistically used spear-phishing emails with a Microsoft Word attachment exploiting the recently patched CVE-2017- 0199 to deploy the ZeroT Trojan, which in turn downloaded the PlugX Remote Access Trojan (RAT). Proofpoint is tracking this attacker, believed to operate out of China, as TA459. The actor typically targets Central Asian countries, Russia, Belarus, Mongolia, and others. TA549 possesses a diverse malware arsenal including PlugX, NetTraveler, and ZeroT.",https://www.proofpoint.com/us/threat-insight/post/apt-targets-financial-analysts
TA505,,UNKNOWN,,"financial institutions, hospitality & retail","CHILE, CHINA, FRANCE, GERMANY, HUNGARY, INDIA, ITALY, MEXICO, MALAWI, PAKISTAN, SOUTH KOREA, TAIWAN, UNITED KINGDOM, UNITED KINGDOM,UNITED STATES","bart, dridex, flawedammy, flawedgrace, globeimposter, jaff, kegotip, locky, lolbins, necurs, neutrino, philadelphia, rockloader, rms, servhelper, shifu, the trick","Proofpoint researchers track a wide range of threat actors involved in both financially motivated cybercrime and state-sponsored actions. One of the more prolific actors that we track - referred to as TA505 - is responsible for the largest malicious spam campaigns we have ever observed, distributing instances of the Dridex banking Trojan, Locky ransomware, Jaff ransomware, The Trick banking Trojan, and several others in very high volumes. Because TA505 is such a significant part of the email threat landscape, this blog provides a retrospective on the shifting malware, payloads, and campaigns associated with this actor. We examine their use malware such as Jaff, Bart, and Rockloader that appear to be exclusive to this group as well as more widely distributed malware like Dridex and Pony. Where possible, we detail the affiliate models with which they are involved and outline the current state of TA505 campaigns. TA505 is arguably one of the most significant financially motivated threat actors because of the extraordinary volumes of messages they send. The variety of malware delivered by the group also demonstrates their deep connections to the underground malware scene. At the time of writing, Locky ransomware remains their malware of choice, even as the group continues to experiment with a variety of additional malware.",
Taidoor,,CHINA,,government & defense,TAIWAN,taidoor,"The Taidoor attackers have been actively engaging in targeted attacks since at least March 4, 2009. Despite some exceptions, the Taidoor campaign often used Taiwanese IP addresses as C&C servers and email addresses to send out socially engineered emails with malware as attachments. One of the primary targets of the Taidoor campaign appeared to be the Taiwanese government. The attackers spoofed Taiwanese government email addresses to send out socially engineered emails in the Chinese language that typically leveraged Taiwan-themed issues. The attackers actively sent out malicious documents and maintained several IP addresses for command and control. As part of their social engineering ploy, the Taidoor attackers attach a decoy document to their emails that, when opened, displays the contents of a legitimate document but executes a malicious payload in the background. We were only able to gather a limited amount of information regarding the Taidoor attackers’ activities after they have compromised a target. We did, however, find that the Taidoor malware allowed attackers to operate an interactive shell on compromised computers and to upload and download files. In order to determine the operational capabilities of the attackers behind the Taidoor campaign, we monitored a compromised honeypot. The attackers issued out some basic commands in an attempt to map out the extent of the network compromise but quickly realized that the honeypot was not an intended targeted and so promptly disabled the Taidoor malware running on it. This indicated that while Taidoor malware were more widely distributed compared with those tied to other targeted campaigns, the attackers could quickly assess their targets and distinguish these from inadvertently compromised computers and honeypots.",https://www.trendmicro.de/cloud-content/us/pdfs/security-intelligence/white-papers/wp_the_taidoor_campaign.pdf
