APT,Aliases,Alleged Location,Allegiance/Affiliation,Targeted Sectors,TARGETED COUNTRIES,TOOL,INFO,REFERENCE
APT37,"ScarCruft, Reaper, Group123, TEMP.Reaper, Ricochet Chollima,Red Eyes, Venus 121",NORTH KOREA,State-sponsored,"aviation & aerospace, automotive, chemical & petrochemical, financial institutions, government & defense, healthcare, manufacturing, high technology","CHINA, INDIA, JAPAN, KUWAIT, NEPAL, ROMANIA, RUSSIA, SOUTH KOREA, UNITED KINGDOM, VIETNAM","coraldeck, dogcall, final1stspy, freenki loader, happywork, karae, kevdroid, n1stagent, navrat, nokki, poohmilk loader, pooraim, rokrat, shutterspeed, slowdrift, winerack","Some research organizations link this group to Lazarus Group, Hidden Cobra, Labyrinth Chollima. (FireEye) Read our report, APT37 (Reaper): The Overlooked North Korean Actor, to learn more about our assessment that this threat actor is working on behalf of the North Korean government, as well as various other details about their operations: • Targeting: Primarily South Korea – though also Japan, Vietnam and the Middle East – in various industry verticals, including chemicals, electronics, manufacturing, aerospace, automotive, and healthcare. • Initial Infection Tactics: Social engineering tactics tailored specifically to desired targets, strategic web compromises typical of targeted cyberespionage operations, and the use of torrent file-sharing sites to distribute malware more indiscriminately. • Exploited Vulnerabilities: Frequent exploitation of vulnerabilities in Hangul Word Processor (HWP), as well as Adobe Flash. The group has demonstrated access to zero-day vulnerabilities (CVE-2018-0802), and the ability to incorporate them into operations. • Command and Control Infrastructure: Compromised servers, messaging platforms, and cloud service providers to avoid detection. The group has shown increasing sophistication by improving their operational security over time. • Malware: A diverse suite of malware for initial intrusion and exfiltration. Along with custom malware used for espionage purposes, APT37 also has access to destructive malware.",https://www2.fireeye.com/rs/848-DID-242/images/rpt_APT37.pdf
APT38,"Bluenoroff, Stardust Chollima, ",NORTH KOREA,,"financial institutions, government & defense, banking","SOUTH KOREA,PHILIPPINES,VIETNAM,ECUADOR,UNITED STATES,BANGLADESH,MEXICO,POLAND,TAIWAN,CHILE,INDIA","dimens, mbr killer, electricfish, duuzer","The Lazarus Group, a nation-state level of attacker tied to the 2014 attacks on Sony Pictures Entertainment, has splintered off a portion of its operation to concentrate on stealing money to fund itself. The group, widely believed to be North Korean, has been linked to a February 2016 attack against the Bangladesh Central bank that resulted in more than $850 million in fraudulent SWIFT network transactions, $80 million of which still has not been recovered.",https://threatpost.com/lazarus-apt-spinoff-linked-to-banking-hacks/124746/
APT39,Chafer,IRAN,State-sponsored,"aviation & aerospace, engineering, government & defense, high technology, it & electronics, shipping & logistics, telecommunications, transportation","ISRAEL, JORDAN, MIDDLE EAST, SAUDI ARABIA, SPAIN, TURKEY, UNITED ARAB EMIRATES,UNITED STATES","aspxspy, cachemoney, eternalblue, httptunnel, mechaflounder mimikatz, nbtscan, non-sucking service manager (nssm), plink, powbat, pwdump, remcom, remexi, seaweed, smb hacking tools, ultravnc, windows credential editor"," APT39 was created to bring together previous activities and methods used by this actor, and its activities largely align with a group publicly referred to as ""Chafer."" However, there are differences in what has been publicly reported due to the variances in how organizations track activity. APT39 primarily leverages the SEAWEED and CACHEMONEY backdoors along with a specific variant of the POWBAT backdoor. While APT39's targeting scope is global, its activities are concentrated in the Middle East. APT39 has prioritized the telecommunications sector, with additional targeting of the travel industry and IT firms that support it and the high-tech industry. APT39's focus on the telecommunications and travel industries suggests intent to perform monitoring, tracking, or surveillance operations against specific individuals, collect proprietary or customer data for commercial or operational purposes that serve strategic requirements related to national priorities, or create additional accesses and vectors to facilitate future campaigns. Government entities targeting suggests a potential secondary intent to collect geopolitical data that may benefit nation-state decision making. Targeting data supports the belief that APT39's key mission is to track or monitor targets of interest, collect personal information, including travel itineraries, and gather customer data from telecommunications firms.",https://www.fireeye.com/blog/threat-research/2019/01/apt39-iranian-cyber-espionage-group-focused-on-personal-information.html
APT41,"Barium, Winnti",CHINA,State-sponsored,"media & entertainment, software & game development, high technology","HONG KONG,FRANCE,INDIA,ITALY,JAPAN,MYANMAR,NETHERLANDS,SINGAPORE,SOUTH KOREA,SWITZERLAND,THAILAND,TURKEY,UNITED STATES,UNITED KINGDOM,SOUTH AFRICA","barlaiy, cobalt strike, plugxl, winnti","Barium begins its attacks by cultivating relationships with potential victims—particularly those working in Business Development or Human Resources—on various social media platforms. Once Barium has established rapport, they spear-phish the victim using a variety of unsophisticated malware installation vectors, including malicious shortcut (.lnk) files with hidden payloads, compiled HTML help (.chm) files, or Microsoft Office documents containing macros or exploits. Initial intrusion stages feature the Win32/Barlaiy implant—notable for its use of social network profiles, collaborative document editing sites, and blogs for C&C. Later stages of the intrusions rely upon Winnti for persistent access. The majority of victims recorded to date have been in electronic gaming, multimedia, and Internet content industries, although occasional intrusions against technology companies have occurred.",https://www.microsoft.com/security/blog/2017/01/25/detecting-threat-actors-in-recent-german-industrial-attacks-with-windows-defender-atp/
Axiom,Group 72,CHINA,State-sponsored,"aviation & aerospace, government & defense, manufacturing, media & entertainment","JAPAN, SOUTH KOREA, TAIWAN,UNITED STATES","cobalt strike, deputydog, derusbi, gh0st rat, hikit, hydraq, plugx, poison ivy, shadowpad winnti, zxshell","Group 72 is a long standing threat actor group involved in Operation SMN, named Axiom by Novetta. The group is sophisticated, well funded, and possesses an established, defined software development methodology. The group targets high profile organizations with high value intellectual property in the manufacturing, industrial, aerospace, defense, media sectors. Geographically, the group almost exclusively targets organizations based in United States, Japan, Taiwan, and Korea. The preferred tactics of the group include watering-hole attacks, spearphishing, and other web-based tactics. The tools and infrastructure used by the attackers are common to a number of other threat actor groups which may indicate some degree of overlap. We have seen similar patterns used in domain registration for malicious domains, and the same tactics used in other threat actor groups leading us to believe that this group may be part of a larger organization that comprises many separate teams, or that different groups share tactics, code and personnel from time to time. Though both this group and Winnti Group, Blackfly, Wicked Panda use the malware Winnti, the two groups appear to be distinct based on differences in reporting on the groups’ TTPs and targeting.",https://blogs.cisco.com/security/talos/threat-spotlight-group-72
BlackTech,,UNKNOWN,,"financial institutions, government & defense, healthcare, it & technology","HONG KONG, JAPAN,TAIWAN","bifrost, drigo, kivars, plead, xbow","BlackTech is a cyber espionage group operating against targets in East Asia, particularly Taiwan, and occasionally, Japan and Hong Kong. Based on the mutexes and domain names of some of their C&C servers, BlackTech’s campaigns are likely designed to steal their target’s technology. Following their activities and evolving tactics and techniques helped us uncover the proverbial red string of fate that connected three seemingly disparate campaigns: PLEAD, Shrouded Crossbow, and of late, Waterbear.",https://blog.trendmicro.com/trendlabs-security-intelligence/following-trail-blacktech-cyber-espionage-campaigns/
BlackOasis,,Middle East,,"media & entertainment, ngo/npo & think tanks, activists & dissidents","AFGHANISTAN, ANGOLA, BAHRAIN, IRAN, IRAQ, JORDAN, LIBYA, NETHERLANDS, NIGERIA, RUSSIA, SAUDI ARABIA, TUNISIA,UNITED KINGDOM","finfisher, finspy, wingbird","BlackOasis is a Middle Eastern threat group that is believed to be a customer of Gamma Group. The group has shown interest in prominent figures in the United Nations, as well as opposition bloggers, activists, regional news correspondents, and think tanks. A group known by Microsoft as Neodymium is reportedly associated closely with BlackOasis operations, but evidence that the group names are aliases has not been identified.",https://www.fireeye.com/blog/threat-research/2017/09/zero-day-used-to-distribute-finspy.html
Bronze Butler,"REDBALDKNIGHT, Tick",CHINA,,"infrastructure, government & defense, manufacturing , it & technology","JAPAN,CHINA,RUSSIA,SINGAPORE,SOUTH KOREA","daserf, datper, gsecdump, mimikatz, minzen, muirim, nioupale, rarstar, windows credential editor, xxmm","CTU analysis indicates that Bronze Bulter primarily targetsorganizations located in Japan. The threat group has sought unauthorized accessto networks of organizations associated with critical infrastructure, heavy industry,manufacturing, and international relations. Secureworks analysts have observed Bronze Bulter exfiltrating the following categories of data:
• Intellectual property related to technology and development
• Product specification
• Sensitive business and sales-related information
• Network and system configuration files
• Email messages and meeting minutes
The focus on intellectual property, product details, and corporate information suggests that the group seeks information that they believe might be of value to competing organizations. The diverse targeting suggests that Bronze Bulter may be tasked by multiple teams or organizations with varying priorities.",https://www.secureworks.com/research/bronze-butler-targets-japanese-businesses
Blind Eagle,APT-C-36,LATIN AMERICA,State-sponsored,"financial institutions, government & defense",COLOMBIA,imminent monitor rat,"Since April 2018, an APT group (Blind Eagle, APT-C-36) suspected coming from South America carried out continuous targeted attacks against Colombian government institutions as well as important corporations in financial sector, petroleum industry, professional manufacturing, etc. Till this moment, 360 Threat Intelligence Center captured 29 bait documents, 62 Trojan samples and multiple related malicious domains in total. Attackers are targeting Windows platform and aiming at government institutions as well as big companies in Colombia",https://ti.360.net/blog/articles/apt-c-36-continuous-attacks-targeting-colombian-government-institutions-and-corporations-en/
Carbanak,"Anunak, Carbon Spider",UKRAINE,,financial institutions,"AUSTRALIA, AUSTRIA, BRAZIL, BULGARIA, CANADA, CHINA, CZECH, FRANCE, GERMANY, HONG KONG, ICELAND, INDIA, LUXEMBURG, MOROCCO, NEPAL, NORWAY, PAKISTAN, POLAND, RUSSIA, SPAIN, SWEDEN, SWITZERLAND, TAIWAN, UNITED KINGDOM, UNITED KINGDOM, UNITED STATES,UZBEKISTAN","agent orm, ammyyrat, antak, ave maria, babymetal, backdoor batel, bateleur, bellhop, mbr eraser, cain & abel, carbanak, cobalt strike, dnsmessenger, dnsrat, driftpin, griffon, halfbaked, js flash, klrd, mimikatz, mbr eraser, netscan, odinaff, powerpipe, powersource, psexec, sekur, socksbot, softperfect network scanner, sqlrat, team viewer, tinymet, vb flash","Carbanak is a threat group that mainly targets banks. It also refers to malware of the same name (Carbanak). It is sometimes referred to as FIN7, but these appear to be two groups using the same Carbanak malware and are therefore tracked separately. (Kaspersky) From late 2013 onwards, several banks and financial institutions have been attacked by an unknown group of cybercriminals. In all these attacks, a similar modus operandi was used. According to victims and the law enforcement agencies
(LEAs) involved in the investigation, this could result in cumulative losses of up to 1 billion USD. The attacks are still active. This report provides a technical analysis of these attacks. The motivation for the attackers, who are making use of techniques commonly seen in Advanced Persistent Threats (APTs), appears to be financial gain as opposed to espionage. An analysis of the campaign has revealed that the initial infections were achieved using spear phishing emails that appeared to be legitimate banking communications, with Microsoft Word 97 – 2003 (.doc) and Control Panel Applet (.CPL) files attached. We believe that the attackers also redirected to exploit kits website traffic that related to financial activity.",https://media.kasperskycontenthub.com/wp-content/uploads/sites/43/2018/03/08064518/Carbanak_APT_eng.pdf
Careto,"The Mask, Mask,  Ugly Face",SPAIN,,"diplomatic/embassies, higher education, energy, government & defense.","BRAZIL, FRANCE, GERMANY, IRAN, LIBYA, MOROCCO, POLAND, SOUTH AFRICA, SPAIN, SWITZERLAND, TUNISIA, UNITED KINGDOM, UNITED STATES,VENEZUELA",careto," The Mask is an advanced threat actor that has been involved in cyberespionage operations since at least 2007. The name ""Mask"" comes from the Spanish slang word ""Careto"" (""Ugly Face"" or “Mask”) which the authors included in some of the malware modules. More than 380 unique victims in 31 countries have been observed to date. What makes “The Mask” special is the complexity of the toolset used by the attackers. This includes an extremely sophisticated malware, a rootkit, a bootkit, 32-and 64-bit Windows versions, Mac OS X and Linux versions and possibly versions for Android and iPad/iPhone (Apple iOS).",https://d2538mqrb7brka.cloudfront.net/wp-content/uploads/sites/43/2018/03/20133638/unveilingthemask_v1.0.pdf
Charming Kitten,"Newscaster, NewsBeef, Parastoo, Group 83",IRAN,,government & defense,"AFGHANISTAN, ALGERIA, BRAZIL, CHINA, DENMARK, FRANCE, GERMANY, INDIA, IRAN, IRAQ, ISRAEL, JAPAN, ROMANIA, RUSSIA, SWITZERLAND, SYRIA, TURKEY, UNITED ARAB EMIRATES, UNITED KINGDOM, UNITED STATES","downpaper, firemalv, macdownloader, stealer builder","Charming Kitten is an Iranian cyberespionage group that has been active since approximately 2014. They appear to focus on targeting individuals of interest to Iran who work in academic research, human rights, and media, with most victims having been located in Iran, the US, Israel, and the UK. Charming Kitten usually tries to access private email and Facebook accounts, and sometimes establishes a foothold on victim computers as a secondary objective. The group's TTPs overlap extensively with another group, Magic Hound, APT 35, Cobalt Gypsy, Rocket Kitten, resulting in reporting that may not distinguish between the two groups' activities.",https://attack.mitre.org/groups/G0058/
Cutting Kitten,"Threat Group 2889, TG-2889, Cutting Kitten",IRAN,"State-sponsored, security company ITSecTeam","aviation & aerospace, chemical & petrochemical, higher education, energy, financial institutions, banking, government & defense, healthcare, mining,oil & gas, it & electronics, telecommunications, transportation, utilities","CANADA, CHINA, FRANCE, GERMANY, INDIA, ISRAEL, KUWAIT, MEXICO, NETHERLANDS, PAKISTAN, QATAR, SAUDI ARABIA, SOUTH KOREA, TURKEY, UNITED ARAB EMIRATES, UNITED KINGDOM, UNITED STATES","csext, jasus, kagent, net crawler, pvcout, synflooder, tinyzbot, wndtest, zhmimikatz","Cleaver is a threat group that has been attributed to Iranian actors and is responsible for activity tracked as Operation Cleaver. Strong circumstantial evidence suggests Cleaver is linked to Threat Group 2889 (TG-2889). This group evolved into Magic Hound, APT 35, Cobalt Gypsy, Rocket Kitten.",https://www.cylance.com/content/dam/cylance/pages/operation-cleaver/Cylance_Operation_Cleaver_Report.pdf
Cobalt Group,"Cobalt Gang, Cobalt Spider, Gold Kingswood",RUSSIA,,financial institutions,"ARGENTINA, ARMENIA, AUSTRIA, AZERBAIJAN, BELARUS, BULGARIA, CANADA, CHINA, CZECH, ESTONIA, GEORGIA, ITALY, JORDAN, KAZAKHSTAN, KUWAIT, KYRGYZSTAN, MALAYSIA, MOLDOVA, NETHERLANDS, POLAND, ROMANIA, RUSSIA, SPAIN, TAIWAN, TAJIKISTAN, THAILAND, TURKEY, UNITED KINGDOM, UNITED STATES, VIETNAM","ammyyrat, atmspitter, atmripper cobalt strike, cobint, cyst downloader, mimikatz, metasploit, more_eggs, sdelete, softperfect network scanner, spicyomelette","Cobalt Group is a financially motivated threat group that has primarily targeted financial institutions. The group has conducted intrusions to steal money via targeting ATM systems, card processing, payment systems and SWIFT systems. Cobalt Group has mainly targeted banks in Eastern Europe, Central Asia, and Southeast Asia. The group has been known to target organizations in order to use their access to then compromise additional victims. Reporting indicates there may be links between Cobalt Group and both the malware Carbanak and the group Carbanak, Anunak.",https://www.group-ib.com/blog/cobalt
CopyKittens,Slayer Kitten,IRAN,,"higher education, government & defense, it & electronics, media & entertainment","GERMANY, ISRAEL, JORDAN, SAUDI ARABIA, TURKEY, UNITED STATES","cobalt strike, empire, matryoshka, tdtess, vminst, zpp","CopyKittens is an Iranian cyberespionage group that has been operating since at least 2013. It has targeted countries including Israel, Saudi Arabia, Turkey, the U.S., Jordan, and Germany. The group is responsible for the campaign known as Operation Wilted Tulip.","https://www.clearskysec.com/wp-content/uploads/2017/07/Operation_Wilted_Tulip.pdf, https://attack.mitre.org/groups/G0052/"
CryptoCore,"Dangerous Password, Leery Turtle","RUSSIA, UKRAINE, ROMANIA",,cryptocurrency exchanges,"UNITED STATES, JAPAN","mimikatz, cageychameleon","In this research, we present a hidden and persistent group, that has been targeting crypto-exchanges, mainly in the US and Japan since as early as 2018. The actor has successfully stolen millions’ worth of cryptocoins. We named it as “CryptoCore” (or “Crypto-gang”), aka “Dangerous Password”, “Leery Turtle”. The CryptoCore report mainly focuses on the group’s profile, modus operandi, and digital infrastructure.",https://www.clearskysec.com/wp-content/uploads/2020/06/CryptoCore_Group.pdf
Dark Caracal,,LEBANON,Lebanese General Directorate of General Security (GDGS),"higher education, financial institutions, government & defense, healthcare, manufacturing, utilities, activists & dissidents, journalists","CHINA, FRANCE, GERMANY, INDIA, ITALY, JORDAN, LEBANON, NEPAL,NETHERLANDS, PAKISTAN, PHILIPPINES, QATAR, RUSSIA, SAUDI ARABIA, SOUTH KOREA,SWITZERLAND, SYRIA, THAILAND, UNITED STATES, VENEZUELA,VIETNAM","bandook, crossrat, finfisher, pallas","Lookout and Electronic Frontier Foundation (EFF) have discovered Dark Caracal3 , a persistent and prolific actor, who at the time of writing is believed to be administered out of a building belonging to the Lebanese General Security Directorate in Beirut. At present, we have knowledge of hundreds of gigabytes of exfiltrated data, in 21+ countries, across thousands of victims. Stolen data includes enterprise intellectual property and personally identifiable information. We are releasing more than 90 indicators of compromise (IOC) associated with Dark Caracal including 11 different Android malware IOCs; 26 desktop malware IOCs across Windows, Mac, and Linux; and 60 domain/IP based IOCs. Dark Caracal targets include individuals and entities that a nation state might typically attack, including governments, military targets, utilities, financial institutions, manufacturing companies, and defense contractors. We specifically uncovered data associated with military personnel, enterprises, medical professionals, activists, journalists, lawyers, and educational institutions during this investigation. Types of data include documents, call records, audio recordings, secure messaging client content, contact information, text messages, photos, and account data.",https://info.lookout.com/rs/051-ESQ-475/images/Lookout_Dark-Caracal_srr_20180118_us_v.1.0.pdf
Darkhotel,"APT-C-06, SIG25, Dubnium, Fallout Team, Shadow Crane",SOUTH KOREA,State-sponsored,"energy, government & defense, healthcare, ngo/npo & think tanks, pharmaceutical, research institute, it & technology.","BANGLADESH, BELGIUM, CHINA, GERMANY, GREECE, HONG KONG, INDIA,INDONESIA, IRELAND, ITALY, JAPAN, KAZAKHSTAN, LEBANON, NORTH KOREA, MEXICO,MOZAMBIQUE, PAKISTAN, PHILIPPINES, RUSSIA, SERBIA, SINGAPORE, SOUTH KOREA,TAIWAN, THAILAND, UNITED ARAB EMIRATES, UNITED STATES","darkhotel, greezebackdoor, luder, nemim, pioneer, tapaoux","The activities of the DarkHotel advanced persistent threat (APT) actor came to light in November 2014, when Kaspersky published a report detailing a sophisticated cyberespionage campaign targeting business travelers in the Asia-Pacific region. The group has been around for nearly a decade and some researchers believe its members are Korean speakers. The attackers targeted their victims using several methods, including through their hotel’s Wi-Fi, zero-day exploits and peer-to-peer (P2P) file sharing websites. Nearly one year later, the threat group was observed using new attack techniques and an exploit leaked from Italian spyware maker Hacking Team. DarkHotel victims have been spotted in several countries, including North Korea, Russia, South Korea, Japan, Bangladesh, Thailand, Taiwan, China, the United States, India, Mozambique, Indonesia and Germany. Up until recently, the attacks appeared to focus on company executives, researchers and development personnel from sectors such as defense industrial base, military, energy, government, NGOs, electronics manufacturing, pharmaceutical, and medical. In more recent DarkHotel attacks it has dubbed “Inexsmar,” security firm Bitdefender said the hackers targeted political figures, and they appeared to be using some new methods.",https://www.securityweek.com/darkhotel-apt-uses-new-methods-target-politicians
DarkHydrus,LazyMeerkat,IRAN,,"government & defense , higher educational ","ISRAEL, SAUDI ARABIA, JORDAN","cobalt strike, mimikatz, phishery, roguerobin",DarkHydrus is a threat group that has targeted government agencies and educational institutions in the Middle East since at least 2016. The group heavily leverages open-source tools and custom payloads for carrying out attacks.,https://attack.mitre.org/groups/G0079/
Deep Panda,"Shell Crew, WebMasters, KungFu Kittens, PinkPanther, Black Vine, Group 13",CHINA,,"financial institutions, government & defense, telecommunications, ngo/npo & think tanks","AUSTRALIA, UNITED STATES","cobalt strike, derusbi, jerseymikes, mivast, plugx, sakula, streamex, tasklist","Deep Panda is a suspected Chinese threat group known to target many industries, including government, defense, financial, and telecommunications. The intrusion into healthcare company Anthem has been attributed to Deep Panda. This group is also known as Shell Crew, WebMasters, KungFu Kittens, and PinkPanther. Deep Panda also appears to be known as Black Vine based on the attribution of both group names to the Anthem intrusion. Some analysts track Deep Panda and APT 19, C0d0so as the same group, but it is unclear from open source information if the groups are the same.",https://attack.mitre.org/groups/G0009/
